{
  "content_id": "lf-short-009",
  "niche": "ai_stories",
  "language": "en",
  "working_title": "The Message From Ten Years Ahead",
  "hook": "Every night at 11:47, Kai receives a message from himself.",
  "script": [
    {
      "index": 1,
      "text": "Every night at 11:47, Kai receives a message from himself.",
      "duration_seconds": 3.5,
      "emotion": "tense",
      "visual": "Close-up of a glowing phone on a dark bedside table, blue light on a young man's worried face, rain on the window."
    },
    {
      "index": 2,
      "text": "The sender is Kai, ten years older. The first message says: don't take the 7:10 train.",
      "duration_seconds": 6.0,
      "emotion": "uneasy",
      "visual": "Medium shot of the same young man staring at the phone screen, a faint older reflection of him in the dark window."
    },
    {
      "index": 3,
      "text": "He listens. That evening, the news says the 7:10 never reached its station.",
      "duration_seconds": 5.5,
      "emotion": "shocked",
      "visual": "Wide shot of an empty train platform at dusk, a departure board gone dark, a single abandoned umbrella on the ground."
    },
    {
      "index": 4,
      "text": "Night after night, the messages save him. A fire. A fall. A call he almost answered.",
      "duration_seconds": 6.5,
      "emotion": "relieved",
      "visual": "Montage-style triptych: smoke curling under a door, a cracked staircase handrail, a ringing phone left face down on a table."
    },
    {
      "index": 5,
      "text": "Then comes a message with no warning, only a rule: never open the door tonight.",
      "duration_seconds": 5.5,
      "emotion": "ominous",
      "visual": "Close-up of the phone screen with a single short line of text, the young man's thumb hovering, the apartment lights flickering."
    },
    {
      "index": 6,
      "text": "At 11:47, the doorbell rings. Through the glass, Kai sees his own face, smiling.",
      "duration_seconds": 6.0,
      "emotion": "dread",
      "visual": "Interior hallway shot toward a frosted-glass front door, a silhouette behind it with a calm, unsettling smile, cold porch light."
    },
    {
      "index": 7,
      "text": "His phone lights up one last time: That isn't me.",
      "duration_seconds": 5.0,
      "emotion": "chilling",
      "visual": "Extreme close-up of the glowing phone in the young man's trembling hand, the doorbell ringing again in the dark background."
    }
  ],
  "cta": null,
  "estimated_duration_seconds": 38.0,
  "content_type": "short",
  "parent_content_id": null
}
