{
  "content_id": "lf-short-001",
  "content_type": "short",
  "parent_content_id": null,
  "niche": "ai_stories",
  "language": "en",
  "working_title": "The Last Train Home",
  "hook": "Platform Nine was sealed the night Elias vanished. So who left wet footprints inside?",
  "script": [
    {
      "index": 1,
      "text": "Platform Nine was sealed the night Elias vanished. So who left wet footprints inside?",
      "duration_seconds": 5.6,
      "emotion": "intrigue",
      "visual": "Nora, a 29-year-old station cleaner with dark wavy hair tied low and a rust-red raincoat, stands alone before a sealed gate in a vast rain-dark station; wide low-angle frame, teal shadows and amber lamps."
    },
    {
      "index": 2,
      "text": "Nora had cleaned this station for twenty years, still listening for his name.",
      "duration_seconds": 5.2,
      "emotion": "loneliness",
      "visual": "Close view of Nora's brass janitor keys and silver watch as she cleans the empty platform; her small reflection appears in wet tile, soft amber light against deep blue night."
    },
    {
      "index": 3,
      "text": "At midnight, its dead timetable flickered and printed two tickets for tomorrow.",
      "duration_seconds": 4.8,
      "emotion": "unease",
      "visual": "The old amber timetable suddenly glows while Nora turns toward it; two blank paper tickets slide from a slot, medium over-shoulder framing, no readable text."
    },
    {
      "index": 4,
      "text": "One carried Nora's name. The other read Elias, still thirteen.",
      "duration_seconds": 4.0,
      "emotion": "grief",
      "visual": "Nora holds two worn tickets in trembling hands, one child-sized; her face is reflected in the glass behind them, tight close-up, warm light fading into shadow."
    },
    {
      "index": 5,
      "text": "At 12:17, a white light filled the tunnel. Nora reached out.",
      "duration_seconds": 4.8,
      "emotion": "hope",
      "visual": "Nora reaches toward a white train-like light at the far end of the tunnel, rain mist in the air, centered vertical composition and strong backlight."
    },
    {
      "index": 6,
      "text": "The rails ended before the light. No train arrived—only wet prints crossing toward her.",
      "duration_seconds": 5.6,
      "emotion": "revelation",
      "visual": "The rails visibly stop short of the glowing tunnel; fresh footprints cross the wet platform toward Nora, seen from behind her shoulder, cool blue light."
    },
    {
      "index": 7,
      "text": "The board changed: You can go home now, Nora. She followed the footprints.",
      "duration_seconds": 5.2,
      "emotion": "release",
      "visual": "Nora lowers the tickets and follows footprints away from the sealed platform toward a station exit warmed by dawn; medium rear view, amber light opening ahead."
    },
    {
      "index": 8,
      "text": "They led away from the station. For the first time, she stopped looking back.",
      "duration_seconds": 5.6,
      "emotion": "peace",
      "visual": "Nora walks toward a quiet golden city street at sunrise, shoulders finally relaxed, the old station receding behind her, wide vertical composition with gentle rain reflections."
    }
  ],
  "cta": null,
  "estimated_duration_seconds": 40.8
}
